{"schema":1,"req":"3f9a0c27d1e84b56","fw":"1.1.0","uptime_s":41,"bank":{"online":2,"mv":83225,"ma":-8000,"w":-665,"soc_x10":762,"state":"discharging","charger":false,"cell_delta_mv":4},"packs":[{"addr":1,"online":true,"soc_x10":760,"mv":83200,"ma":-4000,"w":-332,"state":"discharging","chg_mos":true,"dsg_mos":true,"cycles":null,"remaining_mah":152000,"cell_min_mv":3465,"cell_max_mv":3469,"temp_min_c":18,"temp_max_c":19,"cells_mv":[3466,3467,3468,3469,3465,3466,3467,3468,3469,3465,3466,3467,3468,3469,3465,3466,3467,3468,3469,3465,3466,3467,3468,3469],"temps_c":null,"balancing":[],"faults":[]},{"addr":2,"online":true,"soc_x10":765,"mv":83250,"ma":-4000,"w":-333,"state":"discharging","chg_mos":true,"dsg_mos":true,"cycles":13,"remaining_mah":152000,"cell_min_mv":3465,"cell_max_mv":3469,"temp_min_c":18,"temp_max_c":19,"cells_mv":[3466,3467,3468,3469,3465,3466,3467,3468,3469,3465,3466,3467,3468,3469,3465,3466,3467,3468,3469,3465,3466,3467,3468,3469],"temps_c":[18,19],"balancing":[],"faults":[]},{"addr":3,"online":false}],"warnings":[{"code":"pack_offline","level":"alarm","pack":3,"text":"PACK 3  not responding"}]}