{"schema":1,"req":"3f9a0c27d1e84b56","fw":"1.1.0","uptime_s":41,"bank":{"online":3,"mv":83250,"ma":-12000,"w":-999,"soc_x10":765,"state":"discharging","charger":false,"cell_delta_mv":124},"packs":[{"addr":1,"online":true,"soc_x10":760,"mv":83200,"ma":-4000,"w":-332,"state":"discharging","chg_mos":true,"dsg_mos":true,"cycles":12,"remaining_mah":152000,"cell_min_mv":3465,"cell_max_mv":3469,"temp_min_c":18,"temp_max_c":19,"cells_mv":[3466,3467,3468,3469,3465,3466,3467,3468,3469,3465,3466,3467,3468,3469,3465,3466,3467,3468,3469,3465,3466,3467,3468,3469],"temps_c":[18,19],"balancing":[],"faults":[]},{"addr":2,"online":true,"soc_x10":765,"mv":83250,"ma":-4000,"w":-333,"state":"discharging","chg_mos":true,"dsg_mos":true,"cycles":13,"remaining_mah":152000,"cell_min_mv":3345,"cell_max_mv":3469,"temp_min_c":18,"temp_max_c":19,"cells_mv":[3466,3467,3468,3469,3465,3466,3345,3468,3469,3465,3466,3467,3468,3469,3465,3466,3467,3468,3469,3465,3466,3467,3468,3469],"temps_c":[18,19],"balancing":[1,4],"faults":[{"pos":0,"trip":false,"text":"cell voltage high"}]},{"addr":3,"online":true,"soc_x10":770,"mv":83300,"ma":-4000,"w":-333,"state":"discharging","chg_mos":true,"dsg_mos":true,"cycles":14,"remaining_mah":152000,"cell_min_mv":3465,"cell_max_mv":3469,"temp_min_c":18,"temp_max_c":19,"cells_mv":[3466,3467,3468,3469,3465,3466,3467,3468,3469,3465,3466,3467,3468,3469,3465,3466,3467,3468,3469,3465,3466,3467,3468,3469],"temps_c":[18,19],"balancing":[],"faults":[]}],"warnings":[{"code":"cell_spread","level":"warn","pack":2,"text":"PACK 2  cell spread 124 mV"},{"code":"bms_fault","level":"warn","pack":2,"text":"PACK 2  cell voltage high"}]}