{"schema":1,"req":"3f9a0c27d1e84b56","fw":"1.1.0","uptime_s":41,"bank":{"online":0,"mv":null,"ma":null,"w":null,"soc_x10":null,"state":"idle","charger":false,"cell_delta_mv":0},"packs":[{"addr":1,"online":false},{"addr":2,"online":false},{"addr":3,"online":false}],"warnings":[{"code":"pack_offline","level":"alarm","pack":1,"text":"PACK 1  not responding"},{"code":"pack_offline","level":"alarm","pack":2,"text":"PACK 2  not responding"},{"code":"pack_offline","level":"alarm","pack":3,"text":"PACK 3  not responding"}]}